{
  "schema_version": "egia-quest.contenido.glosario.v0.1.0",
  "estado": "borrador para revisión humana",
  "fecha": "2026-08-29",
  "sirve_a": "Fase 1 del Plan de Fases y Gates v0.2.0 · DEC-EGIA-029",
  "subjetividad_estrategica": "estudiante universitario de educación general",
  "nota_autoria": "Borrador redactado con asistencia de IA. La autoría, la revisión y la aprobación son humanas.",
  "metodo": "Cada entrada tiene definición breve, definición operativa para este curso y una distinción: qué NO es. La distinción es la parte que evita el uso decorativo del término, y sigue el método del glosario canónico de AI StoryLab.",
  "terminos": [
    {
      "termino": "Abstención justificada",
      "definicion_breve": "Decidir no usar IA en un caso concreto, y poder explicar por qué.",
      "definicion_operativa": "Un caso fechado en el que te apartaste de la herramienta, con la alternativa que tomaste en su lugar.",
      "distincion": "No es desconfianza general ni rechazo de la tecnología. Es una decisión situada, sobre un caso, con razones.",
      "relacionados": [
        "Explicabilidad mínima",
        "Agencia humana"
      ],
      "fuente": "Guía Rápida Estudiantil, BP5"
    },
    {
      "termino": "Accountability",
      "definicion_breve": "Asumir la responsabilidad por lo que produjiste, incluida la reparación cuando sale mal.",
      "definicion_operativa": "Una acción concreta con plazo: qué harías, cuándo y ante quién, si tu trabajo resultara dañino o incorrecto.",
      "distincion": "No es disculparse. Es reparar, y hacerlo donde ocurrió el daño, no en privado con quien te lo señaló.",
      "relacionados": [
        "Reparación",
        "IBATA"
      ],
      "fuente": "Guía Rápida Estudiantil, BP8"
    },
    {
      "termino": "Agencia humana",
      "definicion_breve": "La persona decide, selecciona, interpreta y conserva la autoría.",
      "definicion_operativa": "En cada trabajo hay decisiones que no se delegan: qué entra en el portafolio, qué reflexión escribes, qué defiendes oralmente.",
      "distincion": "No significa hacerlo todo a mano. Significa que la responsabilidad no cambia de manos aunque cambien las herramientas.",
      "relacionados": [
        "Aporte humano",
        "Autoría"
      ],
      "fuente": "heredado de AI StoryLab"
    },
    {
      "termino": "AIAS",
      "definicion_breve": "Escala que declara qué nivel de uso de IA corresponde a cada tarea.",
      "definicion_operativa": "En este curso: Nivel 4, Uso Abierto, en tareas no supervisadas con controles obligatorios; Nivel 0 en exámenes y pruebas supervisadas.",
      "distincion": "No es una escala de permisividad creciente que puedas escoger tú. El nivel lo fija la tarea, y ante la duda se pregunta a la docencia antes de usar IA.",
      "relacionados": [
        "Disclosure",
        "Juego limpio"
      ],
      "fuente": "Guía Rápida Estudiantil, BP10"
    },
    {
      "termino": "Andamiaje",
      "definicion_breve": "Apoyo temporal que se retira a medida que ganas autonomía.",
      "definicion_operativa": "En EGIA Quest: plantilla rellenable en Q0 y Q1, checklist de criterios en Q2 a Q4, y solo el criterio en Q5 y Q6.",
      "distincion": "No se retira la exigencia, se retira el apoyo. La evidencia pedida en Q6 es más difícil, no está menos acompañada por descuido.",
      "relacionados": [
        "Nivel Q",
        "Transferencia"
      ],
      "fuente": "propio EGIA Quest"
    },
    {
      "termino": "Anonimización",
      "definicion_breve": "Quitar de un material lo que permite identificar a una persona.",
      "definicion_operativa": "Antes de procesar respuestas, entrevistas o textos ajenos: fuera nombres, fuera detalles que identifiquen por combinación, y revisión humana del resultado.",
      "distincion": "No basta con borrar el nombre. Una combinación de detalles puede identificar a alguien igual de bien que su nombre.",
      "relacionados": [
        "Dato sensible",
        "Consentimiento situado"
      ],
      "fuente": "heredado de AI StoryLab, SPEC-OP-007"
    },
    {
      "termino": "Aporte humano",
      "definicion_breve": "Lo que tú decidiste, seleccionaste, descartaste y justificaste en un trabajo.",
      "definicion_operativa": "Una sección que separa lo que hizo la herramienta de lo que hiciste tú, con los criterios que aplicaste. Se defiende oralmente en cinco a siete minutos.",
      "distincion": "No se mide en palabras escritas a mano. Un párrafo que reorganizaste con criterio aporta más que tres que tecleaste sin pensar.",
      "relacionados": [
        "Agencia humana",
        "Defensa oral"
      ],
      "fuente": "Guía Rápida Estudiantil, BP4"
    },
    {
      "termino": "Atribución",
      "definicion_breve": "Dar crédito visible a quien produjo lo que usas.",
      "definicion_operativa": "Junto al activo, no en un pie de página que nadie abre: autoría, origen y licencia de cada imagen, audio, texto o fragmento de código.",
      "distincion": "No es lo mismo que citar en la bibliografía. Un activo visual mal atribuido no se arregla con una entrada al final.",
      "relacionados": [
        "Matriz de licencias",
        "Propiedad intelectual"
      ],
      "fuente": "Guía Rápida Estudiantil, BP6"
    },
    {
      "termino": "Autoría",
      "definicion_breve": "Quien firma un trabajo responde por él.",
      "definicion_operativa": "La IA se cita como herramienta en métodos o agradecimientos, nunca como autora. Tu nombre va como autor o autora.",
      "distincion": "No se comparte con una herramienta. Un modelo no puede responder por lo que produjo; tú sí.",
      "relacionados": [
        "Agencia humana",
        "Disclosure"
      ],
      "fuente": "Guía Rápida Estudiantil, consejo 2"
    },
    {
      "termino": "Bitácora de proceso",
      "definicion_breve": "Registro breve de prompts, decisiones y verificaciones mientras trabajas.",
      "definicion_operativa": "De dos a cinco prompts clave, con qué aceptaste, qué rechazaste y por qué; más las fuentes con que verificaste.",
      "distincion": "No es un diario libre ni un volcado del historial de conversación. Es evidencia de proceso, seleccionada por ti.",
      "relacionados": [
        "Disclosure",
        "Evidencia"
      ],
      "fuente": "Guía Rápida Estudiantil, BP2"
    },
    {
      "termino": "Competencia",
      "definicion_breve": "Familia de saberes y decisiones que se desarrolla con evidencias a lo largo del tiempo.",
      "definicion_operativa": "EGIA Quest usa las diez familias heredadas de AI StoryLab, con cuatro niveles orientadores: inicial guiado, exploratorio, autónomo situado y transferente crítico.",
      "distincion": "No es una habilidad que se tiene o no se tiene. Los niveles son orientadores, no calificaciones cerradas.",
      "relacionados": [
        "Nivel Q",
        "Evidencia"
      ],
      "fuente": "heredado de AI StoryLab"
    },
    {
      "termino": "Conocimiento situado",
      "definicion_breve": "Saber que depende del contexto donde se produce y se usa.",
      "definicion_operativa": "Un método que funciona en tu facultad puede no funcionar en otra. Nombrar el contexto es parte de afirmar algo con rigor.",
      "distincion": "No es relativismo. Es precisión sobre el alcance de lo que afirmas.",
      "relacionados": [
        "Transferencia",
        "Transdisciplinariedad"
      ],
      "fuente": "heredado de AI StoryLab"
    },
    {
      "termino": "Consentimiento situado",
      "definicion_breve": "Permiso informado, específico y revocable, dado en el contexto concreto de uso.",
      "definicion_operativa": "Antes de usar la voz, la imagen o los datos de una persona, se explica qué se hará exactamente, quién lo verá y hasta cuándo se conserva.",
      "distincion": "No es una casilla aceptada una vez. Cambia con el contexto: permiso para una clase no es permiso para publicar.",
      "relacionados": [
        "Dato sensible",
        "Anonimización"
      ],
      "fuente": "heredado de AI StoryLab, SPEC-OP-006"
    },
    {
      "termino": "Cuándo no usar IA",
      "definicion_breve": "Campo obligatorio en cada reto: la situación concreta en la que esa herramienta no debe entrar.",
      "definicion_operativa": "Una frase que nombra el caso y la razón. Ejemplo: no uses IA para redactar tu propio disclosure, porque el documento se contradiría a sí mismo.",
      "distincion": "No es una advertencia general de riesgo. Es un límite operativo aplicable a la tarea que tienes delante.",
      "relacionados": [
        "Abstención justificada"
      ],
      "fuente": "propio EGIA Quest"
    },
    {
      "termino": "Dato sensible",
      "definicion_breve": "Información cuya exposición puede dañar a una persona.",
      "definicion_operativa": "Nombres, rostros, voces, situaciones personales, salud, situación económica. Regla práctica: si tienes que preguntar si algo es sensible, trátalo como si lo fuera.",
      "distincion": "No se define por lo secreto que parezca, sino por el daño posible. Una respuesta de encuesta de clase puede serlo.",
      "relacionados": [
        "Anonimización",
        "Consentimiento situado"
      ],
      "fuente": "heredado de AI StoryLab, SPEC-OP-007"
    },
    {
      "termino": "Defensa oral",
      "definicion_breve": "Explicar tu trabajo en voz alta, sin apoyarte en la herramienta.",
      "definicion_operativa": "Cinco a siete minutos, o cinco láminas: problema, decisiones, verificación, límites y «cuándo no usar», transferencia.",
      "distincion": "No es una presentación del resultado. Es una explicación de tus decisiones, y por eso no se puede preparar con IA sin vaciarla.",
      "relacionados": [
        "Aporte humano",
        "Portafolio"
      ],
      "fuente": "Guía Rápida Estudiantil, consejo 9"
    },
    {
      "termino": "Deuda pedagógica",
      "definicion_breve": "Trabajo empezado y no cerrado que el tablero mantiene visible.",